{
  "$schema": "https://json-schema.org/draft/2020-12/schema",
  "$id": "https://schemas.cdsoft.com.cn/vastplan/composition/backend/v1/vastplan.platform-profile.schema.json",
  "title": "VastPlan Backend Platform Profile v1",
  "type": "object",
  "additionalProperties": false,
  "required": ["version", "revision", "id", "target", "serviceClasses", "productCapabilities", "serviceBaselines", "services"],
  "properties": {
    "version": { "$ref": "https://schemas.cdsoft.com.cn/vastplan/composition/common/v1/vastplan.composition-common.schema.json#/$defs/version" },
    "revision": { "$ref": "https://schemas.cdsoft.com.cn/vastplan/composition/common/v1/vastplan.composition-common.schema.json#/$defs/revision" },
    "id": { "$ref": "https://schemas.cdsoft.com.cn/vastplan/composition/common/v1/vastplan.composition-common.schema.json#/$defs/compositionId" },
    "target": {
      "type": "object",
      "additionalProperties": false,
      "required": ["kernel"],
      "properties": { "kernel": { "const": "backend" } }
    },
    "serviceClasses": {
      "type": "array",
      "minItems": 1,
      "uniqueItems": true,
      "items": { "type": "string", "pattern": "^[a-z][a-z0-9._-]{0,127}$" }
    },
    "productCapabilities": {
      "type": "array",
      "maxItems": 128,
      "items": {
        "type": "object",
        "additionalProperties": false,
        "required": ["id", "title", "category", "entryArtifact", "artifacts"],
        "properties": {
          "id": { "type": "string", "pattern": "^[a-z][a-z0-9._-]{0,127}$" },
          "title": { "type": "string", "minLength": 1, "maxLength": 160 },
          "category": { "type": "string", "pattern": "^[a-z][a-z0-9._-]{0,63}$" },
          "entryArtifact": { "type": "string", "pattern": "^[a-z0-9]+(?:[.-][a-z0-9]+)+$" },
          "artifacts": {
            "type": "array",
            "minItems": 1,
            "maxItems": 64,
            "uniqueItems": true,
            "items": { "type": "string", "pattern": "^[a-z0-9]+(?:[.-][a-z0-9]+)+$" }
          }
        }
      }
    },
    "serviceBaselines": {
      "type": "array",
      "items": {
        "type": "object",
        "additionalProperties": false,
        "required": ["id", "serviceClass", "plugins"],
        "properties": {
          "id": { "type": "string", "pattern": "^[a-z][a-z0-9._-]{0,127}$" },
          "serviceClass": { "type": "string", "pattern": "^[a-z][a-z0-9._-]{0,127}$" },
          "plugins": {
            "type": "array",
            "minItems": 1,
            "items": { "$ref": "https://schemas.cdsoft.com.cn/vastplan/deployment/v2/vastplan.deployment.schema.json#/$defs/pluginRef" }
          },
          "config": { "type": "object" }
        }
      }
    },
    "services": {
      "type": "array",
      "items": { "$ref": "https://schemas.cdsoft.com.cn/vastplan/deployment/v2/vastplan.deployment.schema.json#/$defs/serviceUnit" }
    }
  }
}
